"email","name","phoneNumber","address"
"mary.kaddah@gmail.com","Mary Kaddah","+971561779802","Sunrise Building 401"
"sara_j86@hotmail.com","Sara Al Zaabi","+971501044600","Al zaab, street Tanjah 12 Villa #50"
"niamzaid@yahoo.com","Niam Ali","+971564625901","Palm jumeirah Frond E Villa 119"
"jcparhon@gmail.com","wanta","+971545912202","Conrad business tower room 2001"
"catherineya13@gmail.com","Yael Catherine","+971568871774","The Sustainaible city Cluster 4 villa c08"
"ramiza.alakbarova@wellbred.com","Wellbred Trading DMCC","+971527416929","Uptown Tower, WELLBRED TRADING DMCC 2002"
"anthonyecarpio09@gmail.com","Anthony carpio","+971581217037","difc idc brookefield building floor 37"